"var","categoria","Gran excedente habitual","Gran excedente excepcional","Pequeño excedente habitual","Pequeño excedente excepcional","Alcanza gastos familia","No alcanza gastos familia","Solo NBFamiliares","No alcanza NBFamiliares","No sabe"
"P11","Al Frente de todos",0,0,0.25,0.587,0.464,0.293,0.432,0.375,0.868
"P11","A Juntos",0.687,0.9,0.542,0.206,0.246,0.495,0.313,0.343,0.132
"P11","Al Frente de Izquierda",0,0,0.162,0.131,0.02,0.015,0.024,0.093,0
"P11","Al Partido Avanza libertad",0.313,0.1,0.006,0.053,0.193,0.053,0.058,0.053,0
"P11","A “Vamos con vos""",0,0,0,0.01,0.026,0.011,0.008,0.02,0
"P11","Votaría en blanco o anularía",0,0,0.04,0.013,0.051,0.133,0.165,0.116,0
