"clase","Todos","Hombres","Mujeres","16-29 años","30-49 años","50-64 años","65+ años","Hasta primario completo","Secundario completo/incompleto","Terciario completo/incompleto","Fernandez","Macri","Lavagna","Weretilneck","Tortoriello","Horne","Rivero","Comarca Andina","Alto Valle","Valle medio","Valle inferior","Linea sur/meseta","Massa","Grabois","Bullrich","Rodriguez Larreta","Milei"
"Con políticas de shock, mano dura y castigando a los corruptos y ladrones",0.361,0.391,0.327,0.341,0.45,0.302,0.225,0.428,0.337,0.314,0.237,0.541,0.182,0.374,0.465,0.099,0.561,0.306,0.415,0.38,0.313,0.232,0.183,0.35,0.501,0.375,0.609
"Con políticas muy estudiadas y progresivas  para que las transformaciones de fondo necesarias se puedan realizar",0.138,0.16,0.115,0.218,0.126,0.083,0.127,0.07,0.192,0.132,0.098,0.224,0.073,0.135,0.188,0.104,0.034,0.097,0.154,0.128,0.21,0.069,0.111,0.016,0.159,0.095,0.219
"Con políticas de desarrollo que permitan el crecimiento con inclusión social",0.34,0.319,0.363,0.246,0.275,0.453,0.51,0.359,0.309,0.371,0.48,0.129,0.343,0.351,0.181,0.667,0.274,0.367,0.34,0.22,0.317,0.431,0.516,0.426,0.23,0.073,0.06
"Con políticas que limiten los privilegios de los que más tienen y favorezcan a los sectores más vulnerables",0.094,0.061,0.129,0.106,0.095,0.085,0.088,0.133,0.073,0.081,0.125,0.049,0.268,0.1,0.107,0.073,0.109,0.13,0.046,0.086,0.121,0.268,0.142,0.106,0.046,0.132,0.048
"Con políticas revolucionarias que permitan la transformación igualitaria de la sociedad apoyándose en las mayorías populares",0.031,0.04,0.023,0.056,0.029,0.018,0.017,0,0.043,0.051,0.026,0.048,0,0.007,0.012,0.012,0.022,0.065,0.027,0.011,0.004,0,0.007,0.102,0.049,0.075,0.034
"No sabe",0.036,0.029,0.043,0.033,0.025,0.059,0.033,0.01,0.046,0.051,0.034,0.009,0.134,0.033,0.047,0.045,0,0.035,0.018,0.175,0.035,0,0.041,0,0.015,0.25,0.03
