"clase","Todos","Hombres","Mujeres","16-29 años","30-49 años","50-64 años","65+ años","Hasta primario completo","Secundario completo/incompleto","Terciario completo/incompleto","Santiago del Estero","La Banda","Resto"
"A los candidatos del Frente Cívico por Santiago",0.442,0.392,0.489,0.504,0.471,0.329,0.368,0.553,0.386,0.246,0.563,0.519,0.365
"A los candidatos del Frente de Todos",0.07,0.067,0.072,0.071,0.076,0.05,0.077,0.026,0.081,0.162,0.054,0.077,0.076
"A los candidatos de Cambiemos",0.158,0.211,0.11,0.055,0.158,0.27,0.257,0.131,0.174,0.204,0.173,0.04,0.169
"A otros candidatos",0.08,0.079,0.081,0.106,0.11,0.021,0.015,0.037,0.124,0.121,0.05,0.014,0.107
"No sabe",0.25,0.251,0.248,0.264,0.185,0.33,0.283,0.253,0.235,0.267,0.16,0.35,0.283
