"clase","Todos","Hombres","Mujeres","16-29 años","30-49 años","50-64 años","65+ años","CABA","Centro","1 cordón GBA","2 cordón GBA","3 cordón GBA","Cuyo","Interior GBA","NEA","NOA","Patagonia"
"Para protegerse de la enfermedad",0.502,0.506,0.499,0.5,0.523,0.471,0.495,0.509,0.472,0.498,0.538,0.449,0.477,0.53,0.503,0.513,0.482
"Porque soy personal de riesgo",0.384,0.392,0.376,0.389,0.346,0.433,0.403,0.377,0.41,0.377,0.414,0.402,0.372,0.362,0.392,0.326,0.36
"Porque colegas se vacunaron",0.026,0.018,0.033,0,0.036,0.02,0.016,0.036,0.017,0.028,0.008,0.06,0.028,0.036,0.04,0.031,0.023
"Me lo recomendó la institución donde trabajo",0.058,0.049,0.066,0.055,0.058,0.056,0.06,0.048,0.062,0.076,0.025,0.029,0.079,0.04,0.043,0.099,0.1
"No sabe",0.03,0.035,0.026,0.056,0.037,0.02,0.026,0.03,0.039,0.021,0.015,0.06,0.044,0.032,0.022,0.031,0.035
