"clase","Todos","Hombres","Mujeres","16-29 años","30-49 años","50-64 años","65+ años","Hasta primario completo","Secundario completo/incompleto","Terciario completo/incompleto","Weretilneck","Tortoriello","Horne","Massa","Milei","Alto Valle","Comarca Andina","Resto"
"Estoy totalmente en desacuerdo, las universidades públicas son garantía de promoción social y contribuyen a igualar las oportunidades de todos los argentinos",0.468,0.48,0.457,0.499,0.456,0.449,0.495,0.423,0.456,0.533,0.551,0.246,0.704,0.801,0.203,0.468,0.464,0.474
"Estoy en desacuerdo, sin universidades publicas no puede haber crecimiento sostenible ni mejora de la situación económica del país",0.158,0.139,0.178,0.18,0.15,0.138,0.185,0.217,0.162,0.092,0.158,0.183,0.149,0.13,0.165,0.159,0.15,0.165
"Estoy parcialmente de acuerdo, es necesario una reforma profunda del sistema universitario público, incorporando exámenes de ingreso, arancelamiento para dar becas de estudio y racionalización de la oferta de carreras priorizando aquellas orientadas al desarrollo científico, tecnológico, la salud y el desarrollo económico",0.204,0.206,0.202,0.144,0.218,0.218,0.219,0.177,0.215,0.216,0.158,0.328,0.069,0.049,0.344,0.219,0.193,0.194
"Estoy de acuerdo, las universidades publicas son muy ineficientes y costosas. La mayor parte de alumnos nunca terminan sus estudios, hay gran cantidad de carreras innecesarias y están muy politizadas",0.09,0.097,0.082,0.063,0.1,0.118,0.048,0.091,0.081,0.101,0.062,0.159,0.025,0.008,0.163,0.085,0.098,0.088
"Estoy totalmente de acuerdo, las universidades publicas son centros de adoctrinamiento político y sirven a los intereses de los partidos políticos. Sería mejor utilizar esa plata para becar a los alumnos de escasos recursos para que pudieran elegir en que universidad privada estudiar",0.067,0.072,0.061,0.114,0.058,0.068,0.03,0.07,0.078,0.047,0.055,0.072,0.037,0.011,0.113,0.054,0.093,0.059
"No sabe",0.013,0.006,0.02,0,0.018,0.009,0.023,0.022,0.008,0.011,0.016,0.012,0.016,0.001,0.012,0.015,0.002,0.02
