"clase","Todos","Hombres","Mujeres","16-29 años","30-49 años","50-64 años","65+ años","Hasta primario completo","Secundario completo/incompleto","Terciario completo/incompleto","Weretilneck","Tortoriello","Horne","Massa","Milei","Alto Valle","Comarca Andina","Resto"
"Oponerse totalmente y no concurrir a la convocatoria",0.398,0.311,0.52,0.275,0.443,0.343,0.431,0.502,0.554,0.294,0.417,0.049,0.888,0.704,0.118,0,0,0
"Oponerse parcialmente y concurrir a la convocatoria",0.199,0.211,0.182,0.31,0.16,0.132,0.281,0.245,0.08,0.238,0.226,0.2,0.076,0.212,0.19,0,0,0
"Apoyar la iniciativa del gobierno nacional y negociar otros temas en discusión",0.261,0.278,0.237,0.206,0.253,0.401,0.168,0.186,0.196,0.314,0.234,0.528,0.036,0.075,0.499,0,0,0
"Apoyar totalmente la iniciativa del gobierno nacional",0.082,0.112,0.04,0.209,0.049,0.104,0.057,0,0.033,0.131,0.027,0.212,0,0,0.17,0,0,0
"No sabe",0.06,0.088,0.021,0,0.095,0.02,0.063,0.067,0.137,0.023,0.096,0.011,0,0.009,0.023,0,0,0
