"clase","Todos","Hombres","Mujeres","16-29 años","30-49 años","50-64 años","65+ años","Hasta primario completo","Secundario completo/incompleto","Terciario completo/incompleto","Figueroa","Koopmam","Rioseco","Eguía","Massa","Milei","Neuquén","Otra localidad"
"Oponerse totalmente y no concurrir a la convocatoria",0.344,0.362,0.324,0.423,0.319,0.268,0.375,0.448,0.265,0.355,0.405,0.147,0.459,0.255,0.652,0.163,0.396,0.297
"Oponerse parcialmente y concurrir a la convocatoria",0.174,0.146,0.205,0.171,0.177,0.204,0.117,0.105,0.234,0.155,0.169,0.293,0.182,0.031,0.161,0.194,0.149,0.197
"Apoyar la iniciativa del gobierno nacional y negociar otros temas en discusión",0.284,0.316,0.249,0.199,0.325,0.314,0.289,0.228,0.329,0.273,0.269,0.381,0.242,0.265,0.095,0.399,0.254,0.31
"Apoyar totalmente la iniciativa del gobierno nacional",0.149,0.158,0.14,0.133,0.149,0.176,0.145,0.166,0.109,0.198,0.145,0.133,0.057,0.4,0.028,0.22,0.147,0.152
"No sabe",0.049,0.018,0.082,0.074,0.03,0.038,0.074,0.053,0.063,0.019,0.012,0.046,0.06,0.049,0.064,0.024,0.054,0.044
